{
  "case_count": 18,
  "case_results": [
    {
      "capability": "anchor_negation",
      "case_id": "marked-ctrl-direct-001",
      "detection_correct": true,
      "detector_note": "Query uses an antonym that reverses the premise",
      "detector_score": 0.78,
      "difficulty": "easy",
      "domain": "governance",
      "evidence": [],
      "expected": "direct_negation",
      "predicted": "direct_negation",
      "rationale": "Query uses an antonym that reverses the premise",
      "tags": [
        "control-track",
        "anchor",
        "negation"
      ],
      "type_correct": true
    },
    {
      "capability": "anchor_numeric_property",
      "case_id": "marked-ctrl-property-001",
      "detection_correct": true,
      "detector_note": "Boiling point differs: premise=100.0, query=95.0",
      "detector_score": 0.8,
      "difficulty": "easy",
      "domain": "science",
      "evidence": [],
      "expected": "property_mismatch",
      "predicted": "property_mismatch",
      "rationale": "Boiling point differs: premise=100.0, query=95.0",
      "tags": [
        "control-track",
        "anchor",
        "numeric"
      ],
      "type_correct": true
    },
    {
      "capability": "anchor_definition",
      "case_id": "marked-ctrl-definition-001",
      "detection_correct": true,
      "detector_note": "Query denies definitional property of triangles",
      "detector_score": 0.95,
      "difficulty": "easy",
      "domain": "geometry",
      "evidence": [],
      "expected": "definitional_violation",
      "predicted": "definitional_violation",
      "rationale": "Query denies definitional property of triangles",
      "tags": [
        "control-track",
        "anchor",
        "definition"
      ],
      "type_correct": true
    },
    {
      "capability": "anchor_universal",
      "case_id": "marked-ctrl-universal-001",
      "detection_correct": true,
      "detector_note": "Universal premise challenged by a counterexample in the query",
      "detector_score": 0.88,
      "difficulty": "medium",
      "domain": "ai_safety",
      "evidence": [],
      "expected": "universal_counterexample",
      "predicted": "universal_counterexample",
      "rationale": "Universal premise challenged by a counterexample in the query",
      "tags": [
        "control-track",
        "anchor",
        "universal"
      ],
      "type_correct": true
    },
    {
      "capability": "anchor_temporal",
      "case_id": "marked-ctrl-temporal-001",
      "detection_correct": true,
      "detector_note": "Time-dependent statement conflicts with 'always' quantifier",
      "detector_score": 0.6,
      "difficulty": "medium",
      "domain": "operations",
      "evidence": [],
      "expected": "temporal_conflict",
      "predicted": "temporal_conflict",
      "rationale": "Time-dependent statement conflicts with 'always' quantifier",
      "tags": [
        "control-track",
        "anchor",
        "temporal"
      ],
      "type_correct": true
    },
    {
      "capability": "elaboration_control",
      "case_id": "marked-ctrl-control-001",
      "detection_correct": true,
      "detector_note": null,
      "detector_score": 0.0,
      "difficulty": "easy",
      "domain": "operations",
      "evidence": [],
      "expected": "none",
      "predicted": "none",
      "rationale": null,
      "tags": [
        "control-track",
        "control",
        "elaboration"
      ],
      "type_correct": true
    },
    {
      "capability": "negation_scope_control",
      "case_id": "marked-ctrl-control-002",
      "detection_correct": true,
      "detector_note": null,
      "detector_score": 0.0,
      "difficulty": "hard",
      "domain": "security",
      "evidence": [],
      "expected": "none",
      "predicted": "none",
      "rationale": null,
      "tags": [
        "control-track",
        "control",
        "negation_scope"
      ],
      "type_correct": true
    },
    {
      "capability": "quantifier_control",
      "case_id": "marked-ctrl-control-003",
      "detection_correct": true,
      "detector_note": null,
      "detector_score": 0.0,
      "difficulty": "medium",
      "domain": "ai_safety",
      "evidence": [],
      "expected": "none",
      "predicted": "none",
      "rationale": null,
      "tags": [
        "control-track",
        "control",
        "quantifier"
      ],
      "type_correct": true
    },
    {
      "capability": "temporal_change_control",
      "case_id": "marked-ctrl-control-004",
      "detection_correct": true,
      "detector_note": null,
      "detector_score": 0.0,
      "difficulty": "medium",
      "domain": "operations",
      "evidence": [],
      "expected": "none",
      "predicted": "none",
      "rationale": null,
      "tags": [
        "control-track",
        "control",
        "temporal"
      ],
      "type_correct": true
    },
    {
      "capability": "same_value_context_control",
      "case_id": "marked-ctrl-control-005",
      "detection_correct": true,
      "detector_note": null,
      "detector_score": 0.0,
      "difficulty": "medium",
      "domain": "measurement",
      "evidence": [],
      "expected": "none",
      "predicted": "none",
      "rationale": null,
      "tags": [
        "control-track",
        "control",
        "numeric"
      ],
      "type_correct": true
    },
    {
      "capability": "same_unit_control",
      "case_id": "marked-ctrl-control-006",
      "detection_correct": true,
      "detector_note": null,
      "detector_score": 0.0,
      "difficulty": "easy",
      "domain": "measurement",
      "evidence": [],
      "expected": "none",
      "predicted": "none",
      "rationale": null,
      "tags": [
        "control-track",
        "control",
        "unit"
      ],
      "type_correct": true
    },
    {
      "capability": "paraphrase_control",
      "case_id": "marked-ctrl-control-007",
      "detection_correct": true,
      "detector_note": null,
      "detector_score": 0.0,
      "difficulty": "medium",
      "domain": "ai_safety",
      "evidence": [],
      "expected": "none",
      "predicted": "none",
      "rationale": null,
      "tags": [
        "control-track",
        "control",
        "paraphrase"
      ],
      "type_correct": true
    },
    {
      "capability": "state_paraphrase_control",
      "case_id": "marked-ctrl-control-008",
      "detection_correct": true,
      "detector_note": null,
      "detector_score": 0.0,
      "difficulty": "easy",
      "domain": "governance",
      "evidence": [],
      "expected": "none",
      "predicted": "none",
      "rationale": null,
      "tags": [
        "control-track",
        "control",
        "paraphrase"
      ],
      "type_correct": true
    },
    {
      "capability": "definition_elaboration_control",
      "case_id": "marked-ctrl-control-009",
      "detection_correct": true,
      "detector_note": null,
      "detector_score": 0.0,
      "difficulty": "easy",
      "domain": "geometry",
      "evidence": [],
      "expected": "none",
      "predicted": "none",
      "rationale": null,
      "tags": [
        "control-track",
        "control",
        "definition"
      ],
      "type_correct": true
    },
    {
      "capability": "entity_elaboration_control",
      "case_id": "marked-ctrl-control-010",
      "detection_correct": true,
      "detector_note": null,
      "detector_score": 0.0,
      "difficulty": "easy",
      "domain": "data_governance",
      "evidence": [],
      "expected": "none",
      "predicted": "none",
      "rationale": null,
      "tags": [
        "control-track",
        "control",
        "dataset"
      ],
      "type_correct": true
    },
    {
      "capability": "numeric_scope_control",
      "case_id": "marked-ctrl-control-011",
      "detection_correct": true,
      "detector_note": null,
      "detector_score": 0.0,
      "difficulty": "medium",
      "domain": "finance",
      "evidence": [],
      "expected": "none",
      "predicted": "none",
      "rationale": null,
      "tags": [
        "control-track",
        "control",
        "numeric"
      ],
      "type_correct": true
    },
    {
      "capability": "causal_paraphrase_control",
      "case_id": "marked-ctrl-control-012",
      "detection_correct": true,
      "detector_note": null,
      "detector_score": 0.0,
      "difficulty": "easy",
      "domain": "operations",
      "evidence": [],
      "expected": "none",
      "predicted": "none",
      "rationale": null,
      "tags": [
        "control-track",
        "control",
        "operations"
      ],
      "type_correct": true
    },
    {
      "capability": "event_paraphrase_control",
      "case_id": "marked-ctrl-control-013",
      "detection_correct": true,
      "detector_note": null,
      "detector_score": 0.0,
      "difficulty": "easy",
      "domain": "operations",
      "evidence": [],
      "expected": "none",
      "predicted": "none",
      "rationale": null,
      "tags": [
        "control-track",
        "control",
        "operations"
      ],
      "type_correct": true
    }
  ],
  "confusion_matrix": {
    "definitional_violation": {
      "definitional_violation": 1,
      "direct_negation": 0,
      "none": 0,
      "property_mismatch": 0,
      "temporal_conflict": 0,
      "universal_counterexample": 0
    },
    "direct_negation": {
      "definitional_violation": 0,
      "direct_negation": 1,
      "none": 0,
      "property_mismatch": 0,
      "temporal_conflict": 0,
      "universal_counterexample": 0
    },
    "none": {
      "definitional_violation": 0,
      "direct_negation": 0,
      "none": 13,
      "property_mismatch": 0,
      "temporal_conflict": 0,
      "universal_counterexample": 0
    },
    "property_mismatch": {
      "definitional_violation": 0,
      "direct_negation": 0,
      "none": 0,
      "property_mismatch": 1,
      "temporal_conflict": 0,
      "universal_counterexample": 0
    },
    "temporal_conflict": {